ID|transcription|normalized transcription
Weerdiensten hebben overstromingswaarschuwingen afgegeven in laaggelegen gebieden|Weerdiensten hebben overstromingswaarschuwingen afgegeven in laaggelegen gebieden|Weerdiensten hebben overstromingswaarschuwingen afgegeven in laaggelegen gebieden
wees naar een geel huis met een blauw dak|wees naar een geel huis met een blauw dak|wees naar een geel huis met een blauw dak
wie is de minister van onderwijs|wie is de minister van onderwijs|wie is de minister van onderwijs
wie was de gouverneur van de provincie KwaZulu-Natal|wie was de gouverneur van de provincie KwaZulu-Natal|wie was de gouverneur van de provincie KwaZulu-Natal
ze begon tselane mijn kind te zingen|ze begon tselane mijn kind te zingen|ze begon tselane mijn kind te zingen
ze hadden een enorm vuur aangestoken dat de vlammen in het donker ontstak|ze hadden een enorm vuur aangestoken dat de vlammen in het donker ontstak|ze hadden een enorm vuur aangestoken dat de vlammen in het donker ontstak
ze hoorden een luid gebrul|ze hoorden een luid gebrul|ze hoorden een luid gebrul
ze kwamen met alles wat ze konden vinden om te helpen sinds de jakhals weg was|ze kwamen met alles wat ze konden vinden om te helpen sinds de jakhals weg was|ze kwamen met alles wat ze konden vinden om te helpen sinds de jakhals weg was
ze lachten tot ze een man op blote voeten zagen rennen|ze lachten tot ze een man op blote voeten zagen rennen|ze lachten tot ze een man op blote voeten zagen rennen
ze leunden op zijn schouders terwijl ze zongen en elke vogel trok zijn aandacht|ze leunden op zijn schouders terwijl ze zongen en elke vogel trok zijn aandacht|ze leunden op zijn schouders terwijl ze zongen en elke vogel trok zijn aandacht
ze nam het aan en bedankte hem respectvol|ze nam het aan en bedankte hem respectvol|ze nam het aan en bedankte hem respectvol
ze praatten soms terwijl ze aten in een huis met een blauw dak|ze praatten soms terwijl ze aten in een huis met een blauw dak|ze praatten soms terwijl ze aten in een huis met een blauw dak
ze schaamde zich zo omdat iedereen haar zonder broek aan zag rondrennen|ze schaamde zich zo omdat iedereen haar zonder broek aan zag rondrennen|ze schaamde zich zo omdat iedereen haar zonder broek aan zag rondrennen
ze sloegen elkaar op het hoofd|ze sloegen elkaar op het hoofd|ze sloegen elkaar op het hoofd
ze staken een vuur aan om de kou buiten te houden|ze staken een vuur aan om de kou buiten te houden|ze staken een vuur aan om de kou buiten te houden
ze vertelde hen niet over haar droom die haar in haar hart deed glimlachen|ze vertelde hen niet over haar droom die haar in haar hart deed glimlachen|ze vertelde hen niet over haar droom die haar in haar hart deed glimlachen
ze vertelde hen wat er in de keuken gebeurde|ze vertelde hen wat er in de keuken gebeurde|ze vertelde hen wat er in de keuken gebeurde
ze werden officieel een land in tien van de meest raciaal onafhankelijke staten en werden bantustans genoemd|ze werden officieel een land in tien van de meest raciaal onafhankelijke staten en werden bantustans genoemd|ze werden officieel een land in tien van de meest raciaal onafhankelijke staten en werden bantustans genoemd
ze woonden in het oosten voordat ze bij ons in Johannesburg kwamen wonen|ze woonden in het oosten voordat ze bij ons in Johannesburg kwamen wonen|ze woonden in het oosten voordat ze bij ons in Johannesburg kwamen wonen
ze zei tegen mijn baby dat hij te voet naar huis moest gaan|ze zei tegen mijn baby dat hij te voet naar huis moest gaan|ze zei tegen mijn baby dat hij te voet naar huis moest gaan
ze zou een goede vrouw zijn voor de kassamedewerker|ze zou een goede vrouw zijn voor de kassamedewerker|ze zou een goede vrouw zijn voor de kassamedewerker
zei de grote man met een luide kreet|zei de grote man met een luide kreet|zei de grote man met een luide kreet
zei de olifant met zijn trompet dat ze er misschien beter zouden uitzien in een andere kleur|zei de olifant met zijn trompet dat ze er misschien beter zouden uitzien in een andere kleur|zei de olifant met zijn trompet dat ze er misschien beter zouden uitzien in een andere kleur
zei meneer Konijn terwijl hij een halve wortel in zijn zak propte|zei meneer Konijn terwijl hij een halve wortel in zijn zak propte|zei meneer Konijn terwijl hij een halve wortel in zijn zak propte
zeiden de mannen terwijl ze liepen|zeiden de mannen terwijl ze liepen|zeiden de mannen terwijl ze liepen
zij zullen vliegen als een arend|zij zullen vliegen als een arend|zij zullen vliegen als een arend
zijn beste vriend was een goudsmid met prachtig goud en geel goud|zijn beste vriend was een goudsmid met prachtig goud en geel goud|zijn beste vriend was een goudsmid met prachtig goud en geel goud
zijn ingewanden brulden als een leeuw, en hij had duidelijk honger|zijn ingewanden brulden als een leeuw, en hij had duidelijk honger|zijn ingewanden brulden als een leeuw, en hij had duidelijk honger
zoutgesteente graden in graden en hevige hagel|zoutgesteente graden in graden en hevige hagel|zoutgesteente graden in graden en hevige hagel
zullen ze ongeslagen eindigen|zullen ze ongeslagen eindigen|zullen ze ongeslagen eindigen
zwarte azen speelden gelijk met fc barcelona|zwarte azen speelden gelijk met fc barcelona|zwarte azen speelden gelijk met fc barcelona
één niveau met sneeuw en sprays in sutherland|één niveau met sneeuw en sprays in sutherland|één niveau met sneeuw en sprays in sutherland
