ID|transcription|normalized transcription
er zat een mijt achter de ziektekiemen|er zat een mijt achter de ziektekiemen|er zat een mijt achter de ziektekiemen
ereddersburg graden Celsius met harde wind|ereddersburg graden Celsius met harde wind|ereddersburg graden Celsius met harde wind
erustenburg graden graden met zware mist|erustenburg graden graden met zware mist|erustenburg graden graden met zware mist
eston villa en chlsea speelden donderdagavond samen in olympia park|eston villa en chlsea speelden donderdagavond samen in olympia park|eston villa en chlsea speelden donderdagavond samen in olympia park
Felix kreeg zelfs een gele kaart van de scheidsrechter|Felix kreeg zelfs een gele kaart van de scheidsrechter|Felix kreeg zelfs een gele kaart van de scheidsrechter
free state stars en chelsea spelen maandagavond in goble park|free state stars en chelsea spelen maandagavond in goble park|free state stars en chelsea spelen maandagavond in goble park
froome reed als lid van de bradley wiggins-groep|froome reed als lid van de bradley wiggins-groep|froome reed als lid van de bradley wiggins-groep
fulltime punten zijn niet aan beide kanten|fulltime punten zijn niet aan beide kanten|fulltime punten zijn niet aan beide kanten
ga naar het zuidoosten op de kerkstraat|ga naar het zuidoosten op de kerkstraat|ga naar het zuidoosten op de kerkstraat
ga weg ga weg samen|ga weg ga weg samen|ga weg ga weg samen
gerald phiri junior kreeg een rode kaart|gerald phiri junior kreeg een rode kaart|gerald phiri junior kreeg een rode kaart
giraffen in de tuin stonden te popelen om dicht bij deze groep mensen te komen|giraffen in de tuin stonden te popelen om dicht bij deze groep mensen te komen|giraffen in de tuin stonden te popelen om dicht bij deze groep mensen te komen
gluurde een beetje naar de deur|gluurde een beetje naar de deur|gluurde een beetje naar de deur
Golden Arrows en Stoke City speelden beide zaterdag in Outeniqua Park|Golden Arrows en Stoke City speelden beide zaterdag in Outeniqua Park|Golden Arrows en Stoke City speelden beide zaterdag in Outeniqua Park
graden Celsius graden Celsius en wind|graden Celsius graden Celsius en wind|graden Celsius graden Celsius en wind
graden Celsius zijn gevaarlijk|graden Celsius zijn gevaarlijk|graden Celsius zijn gevaarlijk
graden onder de graad van ecradock en mist|graden onder de graad van ecradock en mist|graden onder de graad van ecradock en mist
haar man rolde langzaam zijn houten kist in de rivier|haar man rolde langzaam zijn houten kist in de rivier|haar man rolde langzaam zijn houten kist in de rivier
hawu hawu het is niet meer leuk hij blafte domino die onder het bed vandaan sprong|hawu hawu het is niet meer leuk hij blafte domino die onder het bed vandaan sprong|hawu hawu het is niet meer leuk hij blafte domino die onder het bed vandaan sprong
heeft alle vrouwen ontmoet die hij over planten en planten leerde|heeft alle vrouwen ontmoet die hij over planten en planten leerde|heeft alle vrouwen ontmoet die hij over planten en planten leerde
Help alsjeblieft de sinaasappelboom om groter te worden en geef ons meer rijpe sinaasappels|Help alsjeblieft de sinaasappelboom om groter te worden en geef ons meer rijpe sinaasappels|Help alsjeblieft de sinaasappelboom om groter te worden en geef ons meer rijpe sinaasappels
help me hij zei hijgend dat er iets in de put zit|help me hij zei hijgend dat er iets in de put zit|help me hij zei hijgend dat er iets in de put zit
Het antwoord was om een ​​pompoen te bakken en deze op smaak te brengen met suiker en kaneel|Het antwoord was om een ​​pompoen te bakken en deze op smaak te brengen met suiker en kaneel|Het antwoord was om een ​​pompoen te bakken en deze op smaak te brengen met suiker en kaneel
het fladderde met zijn vleugels, maakte een krassend geluid en viel dood neer|het fladderde met zijn vleugels, maakte een krassend geluid en viel dood neer|het fladderde met zijn vleugels, maakte een krassend geluid en viel dood neer
het is beter omdat meneer Mandela nog leeft|het is beter omdat meneer Mandela nog leeft|het is beter omdat meneer Mandela nog leeft
het is drie maanden en twintig dagen|het is drie maanden en twintig dagen|het is drie maanden en twintig dagen
het is niet in erg goede staat|het is niet in erg goede staat|het is niet in erg goede staat
het is overal het bewijs van rijkdom en leeftijd|het is overal het bewijs van rijkdom en leeftijd|het is overal het bewijs van rijkdom en leeftijd
het klonk als een ruzie|het klonk als een ruzie|het klonk als een ruzie
het konijn schepte niet meer op, vooral de eekhoorn|het konijn schepte niet meer op, vooral de eekhoorn|het konijn schepte niet meer op, vooral de eekhoorn
het kostte hem graden in de vorm van wolken|het kostte hem graden in de vorm van wolken|het kostte hem graden in de vorm van wolken
het kostte hem graden tot graden en het bedekte de wolken|het kostte hem graden tot graden en het bedekte de wolken|het kostte hem graden tot graden en het bedekte de wolken
het nijlpaard bleef huilen en mijn haar brandde tot op de grond|het nijlpaard bleef huilen en mijn haar brandde tot op de grond|het nijlpaard bleef huilen en mijn haar brandde tot op de grond
het varken wil niet over het hek springen en het wordt nu donker|het varken wil niet over het hek springen en het wordt nu donker|het varken wil niet over het hek springen en het wordt nu donker
het veranderde snel in een gesneden beeld|het veranderde snel in een gesneden beeld|het veranderde snel in een gesneden beeld
het was gemaakt van een mengsel van lamsvlees en varkensvlees|het was gemaakt van een mengsel van lamsvlees en varkensvlees|het was gemaakt van een mengsel van lamsvlees en varkensvlees
het werd opgericht door Lucas Mangope, de leider van het huis van de mensen, en ze zaten erin vast|het werd opgericht door Lucas Mangope, de leider van het huis van de mensen, en ze zaten erin vast|het werd opgericht door Lucas Mangope, de leider van het huis van de mensen, en ze zaten erin vast
het zat in een open, zachte plastic bak en was bedekt met een doek|het zat in een open, zachte plastic bak en was bedekt met een doek|het zat in een open, zachte plastic bak en was bedekt met een doek
hete moeder|hete moeder|hete moeder
hier is een melkveehouder met een grote zak kaas|hier is een melkveehouder met een grote zak kaas|hier is een melkveehouder met een grote zak kaas
Hier staat hij op de weg om geen tijd door te brengen op weg naar de studentenstad|Hier staat hij op de weg om geen tijd door te brengen op weg naar de studentenstad|Hier staat hij op de weg om geen tijd door te brengen op weg naar de studentenstad
hierdoor kregen ze instructies van een andere luchthaven|hierdoor kregen ze instructies van een andere luchthaven|hierdoor kregen ze instructies van een andere luchthaven
hij at en zei opgewonden dat hij aan het rusten was toen hij thuiskwam|hij at en zei opgewonden dat hij aan het rusten was toen hij thuiskwam|hij at en zei opgewonden dat hij aan het rusten was toen hij thuiskwam
Hij blafte en blafte totdat hij eindelijk de ezel wist te ontwijken|Hij blafte en blafte totdat hij eindelijk de ezel wist te ontwijken|Hij blafte en blafte totdat hij eindelijk de ezel wist te ontwijken
hij blies mijn hoed af|hij blies mijn hoed af|hij blies mijn hoed af
hij draaide zich om om het hotel binnen te gaan|hij draaide zich om om het hotel binnen te gaan|hij draaide zich om om het hotel binnen te gaan
hij droeg een lappenpop|hij droeg een lappenpop|hij droeg een lappenpop
hij ging naar buiten en keek rond om te zien wie het daar had neergezet|hij ging naar buiten en keek rond om te zien wie het daar had neergezet|hij ging naar buiten en keek rond om te zien wie het daar had neergezet
hij haastte zich langs het konijn dat op het zaad lag, maar stopte toen hij de jakhals bereikte|hij haastte zich langs het konijn dat op het zaad lag, maar stopte toen hij de jakhals bereikte|hij haastte zich langs het konijn dat op het zaad lag, maar stopte toen hij de jakhals bereikte
hij had vandaag helemaal geen grappen|hij had vandaag helemaal geen grappen|hij had vandaag helemaal geen grappen
hij herinnert zich nog de grote race tussen het konijn en de schildpad|hij herinnert zich nog de grote race tussen het konijn en de schildpad|hij herinnert zich nog de grote race tussen het konijn en de schildpad
hij hield ook van schilderen en schilderde wanneer hij de tijd had|hij hield ook van schilderen en schilderde wanneer hij de tijd had|hij hield ook van schilderen en schilderde wanneer hij de tijd had
hij hoorde een jakhals op zijn rug springen|hij hoorde een jakhals op zijn rug springen|hij hoorde een jakhals op zijn rug springen
hij hoorde nog een geluid|hij hoorde nog een geluid|hij hoorde nog een geluid
hij keek naar het leven van een plaatselijke zakenman en hij begon het enorm te waarderen|hij keek naar het leven van een plaatselijke zakenman en hij begon het enorm te waarderen|hij keek naar het leven van een plaatselijke zakenman en hij begon het enorm te waarderen
hij keek naar zijn schapen en kreunde|hij keek naar zijn schapen en kreunde|hij keek naar zijn schapen en kreunde
hij kon het alleen houden als hij de eigenaar niet vond|hij kon het alleen houden als hij de eigenaar niet vond|hij kon het alleen houden als hij de eigenaar niet vond
hij maakt een grapje, meneer, een die hij niet zo goed kan zeggen|hij maakt een grapje, meneer, een die hij niet zo goed kan zeggen|hij maakt een grapje, meneer, een die hij niet zo goed kan zeggen
hij maakte ook een mooie ketting voor de mist|hij maakte ook een mooie ketting voor de mist|hij maakte ook een mooie ketting voor de mist
hij nam het aan en bedankte haar respectvol|hij nam het aan en bedankte haar respectvol|hij nam het aan en bedankte haar respectvol
hij nam zijn jas en zijn rode hoed aan|hij nam zijn jas en zijn rode hoed aan|hij nam zijn jas en zijn rode hoed aan
hij opende onmiddellijk zijn koffer en haalde de overgebleven stukjes brood eruit|hij opende onmiddellijk zijn koffer en haalde de overgebleven stukjes brood eruit|hij opende onmiddellijk zijn koffer en haalde de overgebleven stukjes brood eruit
hij rende naar de schuur en haalde een plank tevoorschijn|hij rende naar de schuur en haalde een plank tevoorschijn|hij rende naar de schuur en haalde een plank tevoorschijn
hij rende weg en liet zijn akker zakken en keek over het hek|hij rende weg en liet zijn akker zakken en keek over het hek|hij rende weg en liet zijn akker zakken en keek over het hek
hij riep onmiddellijk een nieuwe bijeenkomst van alle dieren bijeen|hij riep onmiddellijk een nieuwe bijeenkomst van alle dieren bijeen|hij riep onmiddellijk een nieuwe bijeenkomst van alle dieren bijeen
hij schreeuwde het uit van grote schrik tot hij hardop lachte|hij schreeuwde het uit van grote schrik tot hij hardop lachte|hij schreeuwde het uit van grote schrik tot hij hardop lachte
hij schudde zijn hoofd en hief zijn kin op en tikte met zijn poten|hij schudde zijn hoofd en hief zijn kin op en tikte met zijn poten|hij schudde zijn hoofd en hief zijn kin op en tikte met zijn poten
hij sliep onder zijn bescherming zo lief als een kind|hij sliep onder zijn bescherming zo lief als een kind|hij sliep onder zijn bescherming zo lief als een kind
hij sprong op een van de jongensvoeten en sloeg hem hard|hij sprong op een van de jongensvoeten en sloeg hem hard|hij sprong op een van de jongensvoeten en sloeg hem hard
hij strompelde naar huis in de pijn van de hongerdood, hij maakte zich grote zorgen over de jakhals|hij strompelde naar huis in de pijn van de hongerdood, hij maakte zich grote zorgen over de jakhals|hij strompelde naar huis in de pijn van de hongerdood, hij maakte zich grote zorgen over de jakhals
hij stuurde zijn dieren om het lawaai in het meer hier in het bos te onderdrukken|hij stuurde zijn dieren om het lawaai in het meer hier in het bos te onderdrukken|hij stuurde zijn dieren om het lawaai in het meer hier in het bos te onderdrukken
hij vertelde hen niet over zijn droom die hem in zijn hart deed glimlachen|hij vertelde hen niet over zijn droom die hem in zijn hart deed glimlachen|hij vertelde hen niet over zijn droom die hem in zijn hart deed glimlachen
hij vertelde hun niet over zijn droom die hem zo bang maakte|hij vertelde hun niet over zijn droom die hem zo bang maakte|hij vertelde hun niet over zijn droom die hem zo bang maakte
hij was er zeker van dat geduld niet onbeleefd of respectloos zou zijn|hij was er zeker van dat geduld niet onbeleefd of respectloos zou zijn|hij was er zeker van dat geduld niet onbeleefd of respectloos zou zijn
hij was vijf dagen oud|hij was vijf dagen oud|hij was vijf dagen oud
hij wilde de leeuw niet zien lijden, dorstig en stervend van honger|hij wilde de leeuw niet zien lijden, dorstig en stervend van honger|hij wilde de leeuw niet zien lijden, dorstig en stervend van honger
hij wilde meneer Mandela persoonlijk ontmoeten en de hand schudden|hij wilde meneer Mandela persoonlijk ontmoeten en de hand schudden|hij wilde meneer Mandela persoonlijk ontmoeten en de hand schudden
hij zag de kinderen van het varken in de modder spelen|hij zag de kinderen van het varken in de modder spelen|hij zag de kinderen van het varken in de modder spelen
hij zag een gezicht naar haar kijken|hij zag een gezicht naar haar kijken|hij zag een gezicht naar haar kijken
hij zag jeanne even flauwvallen|hij zag jeanne even flauwvallen|hij zag jeanne even flauwvallen
hij zei dat ik dacht dat dit maar een droom was|hij zei dat ik dacht dat dit maar een droom was|hij zei dat ik dacht dat dit maar een droom was
hmm wees voorzichtig, zei de jakhals|hmm wees voorzichtig, zei de jakhals|hmm wees voorzichtig, zei de jakhals
hoe beklemmend de hitte ook was geweest, het was nu nog beklemmender|hoe beklemmend de hitte ook was geweest, het was nu nog beklemmender|hoe beklemmend de hitte ook was geweest, het was nu nog beklemmender
hoe je rundvlees kookt|hoe je rundvlees kookt|hoe je rundvlees kookt
hoeveel projecten zijn er afgerond|hoeveel projecten zijn er afgerond|hoeveel projecten zijn er afgerond
hoog in de lucht hoestte en niesde hij en liet het zaad vallen|hoog in de lucht hoestte en niesde hij en liet het zaad vallen|hoog in de lucht hoestte en niesde hij en liet het zaad vallen
hou hem in de gaten|hou hem in de gaten|hou hem in de gaten
hun liefde brandde met toenemende helderheid|hun liefde brandde met toenemende helderheid|hun liefde brandde met toenemende helderheid
iedereen schudde het hoofd|iedereen schudde het hoofd|iedereen schudde het hoofd
ifc barcelona speelde gelijkmatig met melodieën bij zonsondergang|ifc barcelona speelde gelijkmatig met melodieën bij zonsondergang|ifc barcelona speelde gelijkmatig met melodieën bij zonsondergang
ifc barcelona versloeg West Bromwich Albion net op tijd voor een penalty shootout|ifc barcelona versloeg West Bromwich Albion net op tijd voor een penalty shootout|ifc barcelona versloeg West Bromwich Albion net op tijd voor een penalty shootout
Ik ben de enige die gekwalificeerd is om de bewaarder van de wereld te zijn|Ik ben de enige die gekwalificeerd is om de bewaarder van de wereld te zijn|Ik ben de enige die gekwalificeerd is om de bewaarder van de wereld te zijn
Ik ben de hele dag alleen in het veld geweest|Ik ben de hele dag alleen in het veld geweest|Ik ben de hele dag alleen in het veld geweest
Ik ben een haas en hij schudt mijn hand|Ik ben een haas en hij schudt mijn hand|Ik ben een haas en hij schudt mijn hand
Ik ben je mistige neefje|Ik ben je mistige neefje|Ik ben je mistige neefje
Ik ben nu misschien moe, maar ik ben nog steeds sneller en sterker dan jij|Ik ben nu misschien moe, maar ik ben nog steeds sneller en sterker dan jij|Ik ben nu misschien moe, maar ik ben nog steeds sneller en sterker dan jij
Ik ben opgevoed zoals de meeste meisjes op Hawaï zijn opgevoed|Ik ben opgevoed zoals de meeste meisjes op Hawaï zijn opgevoed|Ik ben opgevoed zoals de meeste meisjes op Hawaï zijn opgevoed
Ik ben slimmer dan wie dan ook in de stad die leest|Ik ben slimmer dan wie dan ook in de stad die leest|Ik ben slimmer dan wie dan ook in de stad die leest
Ik denk dat ook ik je kan overwinnen door te rennen|Ik denk dat ook ik je kan overwinnen door te rennen|Ik denk dat ook ik je kan overwinnen door te rennen
Ik geloof dat je die manier van spreken in India hebt gevonden|Ik geloof dat je die manier van spreken in India hebt gevonden|Ik geloof dat je die manier van spreken in India hebt gevonden
Ik heb scherpe tanden en klauwen, zei de leeuw|Ik heb scherpe tanden en klauwen, zei de leeuw|Ik heb scherpe tanden en klauwen, zei de leeuw
Ik hield van dit geweldige en leerzame verhaal en blijf goede verhalen voor ons schrijven|Ik hield van dit geweldige en leerzame verhaal en blijf goede verhalen voor ons schrijven|Ik hield van dit geweldige en leerzame verhaal en blijf goede verhalen voor ons schrijven
Ik kan de auto repareren want ik heb een plank in de schuur|Ik kan de auto repareren want ik heb een plank in de schuur|Ik kan de auto repareren want ik heb een plank in de schuur
Ik maak vandaag geen nieuwe kleren|Ik maak vandaag geen nieuwe kleren|Ik maak vandaag geen nieuwe kleren
Ik speel alleen in wat lijkt op een spel dat niet zal worden gewonnen|Ik speel alleen in wat lijkt op een spel dat niet zal worden gewonnen|Ik speel alleen in wat lijkt op een spel dat niet zal worden gewonnen
Ik vond een schommel die het oedeem verklaarde|Ik vond een schommel die het oedeem verklaarde|Ik vond een schommel die het oedeem verklaarde
Ik was de enige die nog over was|Ik was de enige die nog over was|Ik was de enige die nog over was
Ik was zijn beste vriend, zei de melkveehouder|Ik was zijn beste vriend, zei de melkveehouder|Ik was zijn beste vriend, zei de melkveehouder
Ik werk hier vlakbij, waar je iets te eten kunt vinden, zei de man|Ik werk hier vlakbij, waar je iets te eten kunt vinden, zei de man|Ik werk hier vlakbij, waar je iets te eten kunt vinden, zei de man
Ik wil dit kaasbrood, dacht hij, zei de jakhals|Ik wil dit kaasbrood, dacht hij, zei de jakhals|Ik wil dit kaasbrood, dacht hij, zei de jakhals
Ik zal beginnen met het tellen van alle krokodillen en daarna alle konijnen|Ik zal beginnen met het tellen van alle krokodillen en daarna alle konijnen|Ik zal beginnen met het tellen van alle krokodillen en daarna alle konijnen
Ik zal je mijn wagen geven en jij geeft me je plank|Ik zal je mijn wagen geven en jij geeft me je plank|Ik zal je mijn wagen geven en jij geeft me je plank
Ik zal niet weglopen om de korte benen van een oude man te winnen|Ik zal niet weglopen om de korte benen van een oude man te winnen|Ik zal niet weglopen om de korte benen van een oude man te winnen
Ik zie dat jij ook van schilderen houdt|Ik zie dat jij ook van schilderen houdt|Ik zie dat jij ook van schilderen houdt
Ik zie je morgen bij zonsopgang bij deze poort|Ik zie je morgen bij zonsopgang bij deze poort|Ik zie je morgen bij zonsopgang bij deze poort
Ik zorg ervoor dat het statief altijd uitleg geeft over de informatie|Ik zorg ervoor dat het statief altijd uitleg geeft over de informatie|Ik zorg ervoor dat het statief altijd uitleg geeft over de informatie
in Barrington zijn de temperaturen onder de graden|in Barrington zijn de temperaturen onder de graden|in Barrington zijn de temperaturen onder de graden
in cradock graden graden staat er een lichte bries|in cradock graden graden staat er een lichte bries|in cradock graden graden staat er een lichte bries
in dat geval zou het alarm dat vader usmuts erg ongerust zou zijn geweest|in dat geval zou het alarm dat vader usmuts erg ongerust zou zijn geweest|in dat geval zou het alarm dat vader usmuts erg ongerust zou zijn geweest
in de eredivisie versloegen kaizer-leiders de piraten met een score van vier|in de eredivisie versloegen kaizer-leiders de piraten met een score van vier|in de eredivisie versloegen kaizer-leiders de piraten met een score van vier
in de FIFA World Cup versloeg West Ham United Leicester City door een puntloos gelijkspel|in de FIFA World Cup versloeg West Ham United Leicester City door een puntloos gelijkspel|in de FIFA World Cup versloeg West Ham United Leicester City door een puntloos gelijkspel
In de FIFA World Cup werd Manchester United met punten verslagen door Manchester City|In de FIFA World Cup werd Manchester United met punten verslagen door Manchester City|In de FIFA World Cup werd Manchester United met punten verslagen door Manchester City
in de hoorncompetitie spoelden de chefs de piraten met een score van vier|in de hoorncompetitie spoelden de chefs de piraten met een score van vier|in de hoorncompetitie spoelden de chefs de piraten met een score van vier
in de hoorncompetitie spoelden de orlando-piraten de jomo-kosmos met punten aan|in de hoorncompetitie spoelden de orlando-piraten de jomo-kosmos met punten aan|in de hoorncompetitie spoelden de orlando-piraten de jomo-kosmos met punten aan
in de hoorncompetitie spoelden de orlando-piraten die door Polokwane City werden verslagen door een score hierin|in de hoorncompetitie spoelden de orlando-piraten die door Polokwane City werden verslagen door een score hierin|in de hoorncompetitie spoelden de orlando-piraten die door Polokwane City werden verslagen door een score hierin
in de hoorncompetitie werden de bidvests met vier punten verslagen door kaizer-leiders|in de hoorncompetitie werden de bidvests met vier punten verslagen door kaizer-leiders|in de hoorncompetitie werden de bidvests met vier punten verslagen door kaizer-leiders
in de play-offs werd het bidvest verstand geslagen door kaizer leiders met vier punten|in de play-offs werd het bidvest verstand geslagen door kaizer leiders met vier punten|in de play-offs werd het bidvest verstand geslagen door kaizer leiders met vier punten
in de tweede fase van het vertrek van Londen naar Johannesburg in Zuid-Afrika|in de tweede fase van het vertrek van Londen naar Johannesburg in Zuid-Afrika|in de tweede fase van het vertrek van Londen naar Johannesburg in Zuid-Afrika
in een cirkel op het trottoir neemt u de derde afslag|in een cirkel op het trottoir neemt u de derde afslag|in een cirkel op het trottoir neemt u de derde afslag
in het veld op de boerderij graasde de kameel van het paard altijd rustig|in het veld op de boerderij graasde de kameel van het paard altijd rustig|in het veld op de boerderij graasde de kameel van het paard altijd rustig
in het vliegtuig was een babyolifant gewikkeld in een grote deken|in het vliegtuig was een babyolifant gewikkeld in een grote deken|in het vliegtuig was een babyolifant gewikkeld in een grote deken
in philippolis zijn de temperaturen graden|in philippolis zijn de temperaturen graden|in philippolis zijn de temperaturen graden
In plaats van de leeuwenkoning stond een olifantenvrouw naar hem te staren|In plaats van de leeuwenkoning stond een olifantenvrouw naar hem te staren|In plaats van de leeuwenkoning stond een olifantenvrouw naar hem te staren
in psl chippa united versloeg maritzburg verenigd door een score van nee|in psl chippa united versloeg maritzburg verenigd door een score van nee|in psl chippa united versloeg maritzburg verenigd door een score van nee
in psl gouden pijlen verslaan polokwane stad in extra tijd door punten naar|in psl gouden pijlen verslaan polokwane stad in extra tijd door punten naar|in psl gouden pijlen verslaan polokwane stad in extra tijd door punten naar
in psl platina werden sterren verslagen door chippa verenigd door punten|in psl platina werden sterren verslagen door chippa verenigd door punten|in psl platina werden sterren verslagen door chippa verenigd door punten
in psl University of Pretoria versloeg platina-sterren met een score van|in psl University of Pretoria versloeg platina-sterren met een score van|in psl University of Pretoria versloeg platina-sterren met een score van
in psl versloeg jomo cosmos de universiteit van pretoria met vier punten|in psl versloeg jomo cosmos de universiteit van pretoria met vier punten|in psl versloeg jomo cosmos de universiteit van pretoria met vier punten
in psl-wedstrijden versloeg maritzburg united met een puntloos gelijkspel Ajax Kaapstad|in psl-wedstrijden versloeg maritzburg united met een puntloos gelijkspel Ajax Kaapstad|in psl-wedstrijden versloeg maritzburg united met een puntloos gelijkspel Ajax Kaapstad
in Sandton wordt het vanmiddag koud en nat|in Sandton wordt het vanmiddag koud en nat|in Sandton wordt het vanmiddag koud en nat
In september kondigde de mediator de oplossing van het geschil aan|In september kondigde de mediator de oplossing van het geschil aan|In september kondigde de mediator de oplossing van het geschil aan
in september kondigde de omroeper zijn ontslag aan na opnieuw te zijn opgeroepen door het nationaal uitvoerend comité van de anc|in september kondigde de omroeper zijn ontslag aan na opnieuw te zijn opgeroepen door het nationaal uitvoerend comité van de anc|in september kondigde de omroeper zijn ontslag aan na opnieuw te zijn opgeroepen door het nationaal uitvoerend comité van de anc
in september kondigde een bemiddelaar een oplossing voor de onrust aan|in september kondigde een bemiddelaar een oplossing voor de onrust aan|in september kondigde een bemiddelaar een oplossing voor de onrust aan
in Spanje versloeg finale Europese kampioen derde plaats nederland na verlenging|in Spanje versloeg finale Europese kampioen derde plaats nederland na verlenging|in Spanje versloeg finale Europese kampioen derde plaats nederland na verlenging
in Spanje versloeg finale Europese kampioenen derde plaats nederland|in Spanje versloeg finale Europese kampioenen derde plaats nederland|in Spanje versloeg finale Europese kampioenen derde plaats nederland
in supersport united league verslagen door jomo cosmos met vier punten|in supersport united league verslagen door jomo cosmos met vier punten|in supersport united league verslagen door jomo cosmos met vier punten
