ID|transcription|normalized transcription
aan de andere kant ontmoette hij een eenvoudig meisje gekleed in haveloze kleren|aan de andere kant ontmoette hij een eenvoudig meisje gekleed in haveloze kleren|aan de andere kant ontmoette hij een eenvoudig meisje gekleed in haveloze kleren
aan het einde van het veld waren er rotsen en struiken|aan het einde van het veld waren er rotsen en struiken|aan het einde van het veld waren er rotsen en struiken
achter hen hing een taxistandplaats een foto van meneer Mandela|achter hen hing een taxistandplaats een foto van meneer Mandela|achter hen hing een taxistandplaats een foto van meneer Mandela
achtervolg dit varken alsjeblieft|achtervolg dit varken alsjeblieft|achtervolg dit varken alsjeblieft
afranklin temperaturen onder de graad er zijn ook harde wind|afranklin temperaturen onder de graad er zijn ook harde wind|afranklin temperaturen onder de graad er zijn ook harde wind
Ajax Kaapstad en Juventus speelden gelijkmatig|Ajax Kaapstad en Juventus speelden gelijkmatig|Ajax Kaapstad en Juventus speelden gelijkmatig
al snel spruitten zijn zaden uit de grond op zoek naar zon|al snel spruitten zijn zaden uit de grond op zoek naar zon|al snel spruitten zijn zaden uit de grond op zoek naar zon
al zijn haar was verbrand in het vuur|al zijn haar was verbrand in het vuur|al zijn haar was verbrand in het vuur
alberton graden zijn graden|alberton graden zijn graden|alberton graden zijn graden
alle dieren hadden zachte grond nodig en geen cement of beton|alle dieren hadden zachte grond nodig en geen cement of beton|alle dieren hadden zachte grond nodig en geen cement of beton
als het tijd is om naar bed te gaan, zingt hij voor ons totdat we in slaap vallen|als het tijd is om naar bed te gaan, zingt hij voor ons totdat we in slaap vallen|als het tijd is om naar bed te gaan, zingt hij voor ons totdat we in slaap vallen
als ik een traditioneel drankje had, zou het goed passen bij mijn diner vanavond|als ik een traditioneel drankje had, zou het goed passen bij mijn diner vanavond|als ik een traditioneel drankje had, zou het goed passen bij mijn diner vanavond
als ze op weg naar huis van school huilt, bezoekt ze een sinaasappelboom|als ze op weg naar huis van school huilt, bezoekt ze een sinaasappelboom|als ze op weg naar huis van school huilt, bezoekt ze een sinaasappelboom
als ze ziek waren, was er niemand om hen te helpen|als ze ziek waren, was er niemand om hen te helpen|als ze ziek waren, was er niemand om hen te helpen
als zijn vrienden probeerden de rivier over te steken, zouden ze allemaal verdrinken|als zijn vrienden probeerden de rivier over te steken, zouden ze allemaal verdrinken|als zijn vrienden probeerden de rivier over te steken, zouden ze allemaal verdrinken
Arsenal en club atl tico de madrid speelden zaterdag op Outeniqua Park|Arsenal en club atl tico de madrid speelden zaterdag op Outeniqua Park|Arsenal en club atl tico de madrid speelden zaterdag op Outeniqua Park
auto en Lamboo vinden een klaslokaal|auto en Lamboo vinden een klaslokaal|auto en Lamboo vinden een klaslokaal
bedankt dat je de speler op de vleugel hebt laten scoren|bedankt dat je de speler op de vleugel hebt laten scoren|bedankt dat je de speler op de vleugel hebt laten scoren
behaalde de derde plaats in de recent gevormde economische bevrijdingsbeweging|behaalde de derde plaats in de recent gevormde economische bevrijdingsbeweging|behaalde de derde plaats in de recent gevormde economische bevrijdingsbeweging
bekend als een van de meest waardevolle parken|bekend als een van de meest waardevolle parken|bekend als een van de meest waardevolle parken
beweert het eerste nieuws- en chatkanaal in Johannesburg te zijn|beweert het eerste nieuws- en chatkanaal in Johannesburg te zijn|beweert het eerste nieuws- en chatkanaal in Johannesburg te zijn
beïnvloedt temperaturen van vier graden|beïnvloedt temperaturen van vier graden|beïnvloedt temperaturen van vier graden
bidvest wits en bloem celtic spelen dinsdagochtend bij goble park|bidvest wits en bloem celtic spelen dinsdagochtend bij goble park|bidvest wits en bloem celtic spelen dinsdagochtend bij goble park
bidvest wits neaston villa spelen op zaterdagavond in outeniqua park|bidvest wits neaston villa spelen op zaterdagavond in outeniqua park|bidvest wits neaston villa spelen op zaterdagavond in outeniqua park
bij de volgende sprong sprong hij de stad in|bij de volgende sprong sprong hij de stad in|bij de volgende sprong sprong hij de stad in
bij lage temperaturen de mate waarin lucht aanwezig is|bij lage temperaturen de mate waarin lucht aanwezig is|bij lage temperaturen de mate waarin lucht aanwezig is
bij lage temperaturen en er is een deel van de doelwolk|bij lage temperaturen en er is een deel van de doelwolk|bij lage temperaturen en er is een deel van de doelwolk
bij Lake Linderman had ik een kano, een zeer goede Peterborough-kano|bij Lake Linderman had ik een kano, een zeer goede Peterborough-kano|bij Lake Linderman had ik een kano, een zeer goede Peterborough-kano
bij mensendorp temperaturen beneden de graad dat er hagel is|bij mensendorp temperaturen beneden de graad dat er hagel is|bij mensendorp temperaturen beneden de graad dat er hagel is
bij temperaturen en er is zon in de hermanus|bij temperaturen en er is zon in de hermanus|bij temperaturen en er is zon in de hermanus
blijf hier en vertel het aan domino|blijf hier en vertel het aan domino|blijf hier en vertel het aan domino
blijf Zuid-Afrikaanse kinderen opvoeden|blijf Zuid-Afrikaanse kinderen opvoeden|blijf Zuid-Afrikaanse kinderen opvoeden
bloem celtic en newcastle united speelden beide op zaterdag in het voetbalstadion|bloem celtic en newcastle united speelden beide op zaterdag in het voetbalstadion|bloem celtic en newcastle united speelden beide op zaterdag in het voetbalstadion
breng nu een bord zodat ik vandaag mijn hek kan repareren|breng nu een bord zodat ik vandaag mijn hek kan repareren|breng nu een bord zodat ik vandaag mijn hek kan repareren
cato nok temperaturen zijn onder graden|cato nok temperaturen zijn onder graden|cato nok temperaturen zijn onder graden
Chris Bright kreeg een penalty van de scheidsrechter|Chris Bright kreeg een penalty van de scheidsrechter|Chris Bright kreeg een penalty van de scheidsrechter
clubs en voetbalclubs en steden groeiden en lieten herinneringen met rust|clubs en voetbalclubs en steden groeiden en lieten herinneringen met rust|clubs en voetbalclubs en steden groeiden en lieten herinneringen met rust
coega graden zullen zijn|coega graden zullen zijn|coega graden zullen zijn
daarom de woede van het geld op de meest onmiddellijke betaling die hij zal ontvangen|daarom de woede van het geld op de meest onmiddellijke betaling die hij zal ontvangen|daarom de woede van het geld op de meest onmiddellijke betaling die hij zal ontvangen
dan laat hij de stad rusten en gaat naar de koper van goud|dan laat hij de stad rusten en gaat naar de koper van goud|dan laat hij de stad rusten en gaat naar de koper van goud
dan zullen ze zich omdraaien en hem daar achterlaten zonder een woord tegen hem te zeggen|dan zullen ze zich omdraaien en hem daar achterlaten zonder een woord tegen hem te zeggen|dan zullen ze zich omdraaien en hem daar achterlaten zonder een woord tegen hem te zeggen
dat geluid veroorzaakte dominostenen|dat geluid veroorzaakte dominostenen|dat geluid veroorzaakte dominostenen
Dat is een goed ding|Dat is een goed ding|Dat is een goed ding
dat is uw wisselgeld, meneer|dat is uw wisselgeld, meneer|dat is uw wisselgeld, meneer
de bewaker dronk een glas mousserende wijn|de bewaker dronk een glas mousserende wijn|de bewaker dronk een glas mousserende wijn
De boerderij is opgedeeld in woonwijken en wordt kempten genoemd achter de stad Duitse abavaria|De boerderij is opgedeeld in woonwijken en wordt kempten genoemd achter de stad Duitse abavaria|De boerderij is opgedeeld in woonwijken en wordt kempten genoemd achter de stad Duitse abavaria
De Cato Ridge-temperaturen zijn onder nul graden Celsius|De Cato Ridge-temperaturen zijn onder nul graden Celsius|De Cato Ridge-temperaturen zijn onder nul graden Celsius
de chauffeur was aan het praten op zijn mobiele telefoon|de chauffeur was aan het praten op zijn mobiele telefoon|de chauffeur was aan het praten op zijn mobiele telefoon
De coach verving de olifant door de olifant en het spel liep bijna ten einde|De coach verving de olifant door de olifant en het spel liep bijna ten einde|De coach verving de olifant door de olifant en het spel liep bijna ten einde
De coach verving de pauze door de wedstrijd die net begon|De coach verving de pauze door de wedstrijd die net begon|De coach verving de pauze door de wedstrijd die net begon
De coach verving Gabadinho Mhango aan het einde van de wedstrijd|De coach verving Gabadinho Mhango aan het einde van de wedstrijd|De coach verving Gabadinho Mhango aan het einde van de wedstrijd
De coach verving Jeremy Brockie door Kgomotso in de beginfase van de wedstrijd|De coach verving Jeremy Brockie door Kgomotso in de beginfase van de wedstrijd|De coach verving Jeremy Brockie door Kgomotso in de beginfase van de wedstrijd
De coach verving Sheldon van Wyk tijdens de wedstrijd|De coach verving Sheldon van Wyk tijdens de wedstrijd|De coach verving Sheldon van Wyk tijdens de wedstrijd
de coach verving shu aib walters door motamai ramatsa die net aan de wedstrijd was begonnen|de coach verving shu aib walters door motamai ramatsa die net aan de wedstrijd was begonnen|de coach verving shu aib walters door motamai ramatsa die net aan de wedstrijd was begonnen
de coach verving shu aib walters kort na de start van de wedstrijd door motamai ramatsa|de coach verving shu aib walters kort na de start van de wedstrijd door motamai ramatsa|de coach verving shu aib walters kort na de start van de wedstrijd door motamai ramatsa
de dag is een tijd om voedsel te verzamelen|de dag is een tijd om voedsel te verzamelen|de dag is een tijd om voedsel te verzamelen
De doelman Tokelo Rantie van de jongens blokkeerde vier punten in de wedstrijd|De doelman Tokelo Rantie van de jongens blokkeerde vier punten in de wedstrijd|De doelman Tokelo Rantie van de jongens blokkeerde vier punten in de wedstrijd
De doelman van de jongens bedankte ons en scoorde een hattrick in de wedstrijd|De doelman van de jongens bedankte ons en scoorde een hattrick in de wedstrijd|De doelman van de jongens bedankte ons en scoorde een hattrick in de wedstrijd
De doelman van de jongens, urivaldo coetzee, redde de punten die in de wedstrijd gescoord hadden moeten worden|De doelman van de jongens, urivaldo coetzee, redde de punten die in de wedstrijd gescoord hadden moeten worden|De doelman van de jongens, urivaldo coetzee, redde de punten die in de wedstrijd gescoord hadden moeten worden
De doelman van de jongens, Uthulani Hlatshwayo, blokkeerde een paar punten in de wedstrijd|De doelman van de jongens, Uthulani Hlatshwayo, blokkeerde een paar punten in de wedstrijd|De doelman van de jongens, Uthulani Hlatshwayo, blokkeerde een paar punten in de wedstrijd
De doelman Waynene Sandilands van de jongens blokkeerde een score in de wedstrijd|De doelman Waynene Sandilands van de jongens blokkeerde een score in de wedstrijd|De doelman Waynene Sandilands van de jongens blokkeerde een score in de wedstrijd
de dorpeling keek onder de struiken|de dorpeling keek onder de struiken|de dorpeling keek onder de struiken
De Engelse Premier League-kampioen Leicester City versloeg Norwich City met vier punten|De Engelse Premier League-kampioen Leicester City versloeg Norwich City met vier punten|De Engelse Premier League-kampioen Leicester City versloeg Norwich City met vier punten
de ezel at gras bij de vijver|de ezel at gras bij de vijver|de ezel at gras bij de vijver
De giraf kwam met flessen bruisend bronwater om dat heerlijke eten naar beneden te halen|De giraf kwam met flessen bruisend bronwater om dat heerlijke eten naar beneden te halen|De giraf kwam met flessen bruisend bronwater om dat heerlijke eten naar beneden te halen
de graden waren graden|de graden waren graden|de graden waren graden
de haan vertelde de dieren dat de ring om zijn hoofd in brand stond|de haan vertelde de dieren dat de ring om zijn hoofd in brand stond|de haan vertelde de dieren dat de ring om zijn hoofd in brand stond
de keeper zoog de fles leeg|de keeper zoog de fles leeg|de keeper zoog de fles leeg
de laatste keer dat ze niesde, schudde ze al mijn rode bloemen|de laatste keer dat ze niesde, schudde ze al mijn rode bloemen|de laatste keer dat ze niesde, schudde ze al mijn rode bloemen
de leraar kon het niet geloven toen we hem vertelden dat het kwam door niezen|de leraar kon het niet geloven toen we hem vertelden dat het kwam door niezen|de leraar kon het niet geloven toen we hem vertelden dat het kwam door niezen
de mistmoeder maakte een enkel lint met linten, knopen en kralen|de mistmoeder maakte een enkel lint met linten, knopen en kralen|de mistmoeder maakte een enkel lint met linten, knopen en kralen
de muizen wilden hun eigen kuilen graven|de muizen wilden hun eigen kuilen graven|de muizen wilden hun eigen kuilen graven
De neus werd plat op het gezicht|De neus werd plat op het gezicht|De neus werd plat op het gezicht
De nieuwe editie probeert naast de basisrecepten de basisvorm van een receptenboek te behouden|De nieuwe editie probeert naast de basisrecepten de basisvorm van een receptenboek te behouden|De nieuwe editie probeert naast de basisrecepten de basisvorm van een receptenboek te behouden
De nieuwe vlag verving de vlag die sindsdien in gebruik was|De nieuwe vlag verving de vlag die sindsdien in gebruik was|De nieuwe vlag verving de vlag die sindsdien in gebruik was
de oude man stond op en zei tegen zichzelf dat hij nooit zou opgeven|de oude man stond op en zei tegen zichzelf dat hij nooit zou opgeven|de oude man stond op en zei tegen zichzelf dat hij nooit zou opgeven
de pijl doorboorde het hart van de vogel en deed het grommen|de pijl doorboorde het hart van de vogel en deed het grommen|de pijl doorboorde het hart van de vogel en deed het grommen
de scheidsrechter gaf Anthony Laffor een penalty|de scheidsrechter gaf Anthony Laffor een penalty|de scheidsrechter gaf Anthony Laffor een penalty
De scheidsrechter gaf Evans een strafschop|De scheidsrechter gaf Evans een strafschop|De scheidsrechter gaf Evans een strafschop
De scheidsrechter gaf Real Madrid een strafschop|De scheidsrechter gaf Real Madrid een strafschop|De scheidsrechter gaf Real Madrid een strafschop
De scheidsrechter kende de strafvilla een strafschop toe|De scheidsrechter kende de strafvilla een strafschop toe|De scheidsrechter kende de strafvilla een strafschop toe
De scheidsrechter kende de trap toe aan Boris Savi|De scheidsrechter kende de trap toe aan Boris Savi|De scheidsrechter kende de trap toe aan Boris Savi
de scheidsrechter kende een penalty toe Stoke City|de scheidsrechter kende een penalty toe Stoke City|de scheidsrechter kende een penalty toe Stoke City
De sprinkhanen zeiden dat we naar de bladeren moesten zoeken|De sprinkhanen zeiden dat we naar de bladeren moesten zoeken|De sprinkhanen zeiden dat we naar de bladeren moesten zoeken
de teamcoach in plaats van sifiso mbhele verving bardard parker tijdens de wedstrijd|de teamcoach in plaats van sifiso mbhele verving bardard parker tijdens de wedstrijd|de teamcoach in plaats van sifiso mbhele verving bardard parker tijdens de wedstrijd
de temperaturen en wind zijn sterk in de haven|de temperaturen en wind zijn sterk in de haven|de temperaturen en wind zijn sterk in de haven
De temperaturen in New Hannover zijn graden met zware hagel|De temperaturen in New Hannover zijn graden met zware hagel|De temperaturen in New Hannover zijn graden met zware hagel
De tijger antwoordde dat we je gitaar hadden gepakt en je strategie kenden|De tijger antwoordde dat we je gitaar hadden gepakt en je strategie kenden|De tijger antwoordde dat we je gitaar hadden gepakt en je strategie kenden
De tour omvatte slechts vier games en één test per|De tour omvatte slechts vier games en één test per|De tour omvatte slechts vier games en één test per
De verdedigende speler schudde de bal en sloeg de bal met zijn hoofd|De verdedigende speler schudde de bal en sloeg de bal met zijn hoofd|De verdedigende speler schudde de bal en sloeg de bal met zijn hoofd
de volgende dag belde de tuinman kort daarna de leraar|de volgende dag belde de tuinman kort daarna de leraar|de volgende dag belde de tuinman kort daarna de leraar
De volgende ochtend schrok het konijn op van een geluid dat uit zijn deur kwam|De volgende ochtend schrok het konijn op van een geluid dat uit zijn deur kwam|De volgende ochtend schrok het konijn op van een geluid dat uit zijn deur kwam
de vrouw was al snel terug op het strand met de gave van beelden|de vrouw was al snel terug op het strand met de gave van beelden|de vrouw was al snel terug op het strand met de gave van beelden
de zwarte azen versloegen Chelsea door een puntloos gelijkspel in de penalty shootout|de zwarte azen versloegen Chelsea door een puntloos gelijkspel in de penalty shootout|de zwarte azen versloegen Chelsea door een puntloos gelijkspel in de penalty shootout
defensive back ukeagan dolly sloeg de bal met zijn hoofd|defensive back ukeagan dolly sloeg de bal met zijn hoofd|defensive back ukeagan dolly sloeg de bal met zijn hoofd
degenen die niet kunnen lezen, blijven hun fouten herhalen en schreeuwen|degenen die niet kunnen lezen, blijven hun fouten herhalen en schreeuwen|degenen die niet kunnen lezen, blijven hun fouten herhalen en schreeuwen
deze keer werd hij betaald met een goed stuk vlees|deze keer werd hij betaald met een goed stuk vlees|deze keer werd hij betaald met een goed stuk vlees
die drie leugens|die drie leugens|die drie leugens
die erg ongewijzigd blijft|die erg ongewijzigd blijft|die erg ongewijzigd blijft
die is samengesteld uit drie leden|die is samengesteld uit drie leden|die is samengesteld uit drie leden
die naar Europa gaat om zijn carrière voort te zetten|die naar Europa gaat om zijn carrière voort te zetten|die naar Europa gaat om zijn carrière voort te zetten
die ouders heeft verloren|die ouders heeft verloren|die ouders heeft verloren
dillon sheppard kreeg een gele kaart van de scheidsrechter|dillon sheppard kreeg een gele kaart van de scheidsrechter|dillon sheppard kreeg een gele kaart van de scheidsrechter
dit betekent dat het bedtijd is|dit betekent dat het bedtijd is|dit betekent dat het bedtijd is
Dit gerecht uit Kaapstad bestaat al eeuwen|Dit gerecht uit Kaapstad bestaat al eeuwen|Dit gerecht uit Kaapstad bestaat al eeuwen
Dit heeft uiteindelijk geleid tot de oprichting van een forum voor dialoog tussen India, Brazilië en Zuid-Afrika|Dit heeft uiteindelijk geleid tot de oprichting van een forum voor dialoog tussen India, Brazilië en Zuid-Afrika|Dit heeft uiteindelijk geleid tot de oprichting van een forum voor dialoog tussen India, Brazilië en Zuid-Afrika
dit is een zondagse ontbijt waar je van geniet met een koffiemok|dit is een zondagse ontbijt waar je van geniet met een koffiemok|dit is een zondagse ontbijt waar je van geniet met een koffiemok
dit maakt alle dieren bang voor de haan|dit maakt alle dieren bang voor de haan|dit maakt alle dieren bang voor de haan
dit maakte het nog moeilijker voor de regering om de ambtsperiode te behouden|dit maakte het nog moeilijker voor de regering om de ambtsperiode te behouden|dit maakte het nog moeilijker voor de regering om de ambtsperiode te behouden
Doelman Thulani Urero van de jongens blokkeerde een score in de wedstrijd|Doelman Thulani Urero van de jongens blokkeerde een score in de wedstrijd|Doelman Thulani Urero van de jongens blokkeerde een score in de wedstrijd
doet me denken aan onze appelboom en zei het antwoord|doet me denken aan onze appelboom en zei het antwoord|doet me denken aan onze appelboom en zei het antwoord
domino was wit met drie zwarte vlekken op zijn rug|domino was wit met drie zwarte vlekken op zijn rug|domino was wit met drie zwarte vlekken op zijn rug
door het voormalige Zuid-Afrikaanse bedrijf werd omgevormd tot een Zuid-Afrikaanse districtsunie|door het voormalige Zuid-Afrikaanse bedrijf werd omgevormd tot een Zuid-Afrikaanse districtsunie|door het voormalige Zuid-Afrikaanse bedrijf werd omgevormd tot een Zuid-Afrikaanse districtsunie
dunham kan je zoon meegaan met jesse|dunham kan je zoon meegaan met jesse|dunham kan je zoon meegaan met jesse
dus de mist liet de riem en de ijzers los|dus de mist liet de riem en de ijzers los|dus de mist liet de riem en de ijzers los
dus het geluid van het geld van de sjamaan is de prijs die je krijgt voor de zoete geur die hij stal|dus het geluid van het geld van de sjamaan is de prijs die je krijgt voor de zoete geur die hij stal|dus het geluid van het geld van de sjamaan is de prijs die je krijgt voor de zoete geur die hij stal
ebathurst graden zijn graden|ebathurst graden zijn graden|ebathurst graden zijn graden
ebetty s bay graden en er zijn harde wind|ebetty s bay graden en er zijn harde wind|ebetty s bay graden en er zijn harde wind
een nieuwe profeet heeft nieuwe wetten uit Jeruzalem meegebracht|een nieuwe profeet heeft nieuwe wetten uit Jeruzalem meegebracht|een nieuwe profeet heeft nieuwe wetten uit Jeruzalem meegebracht
eerst zal ik zwijgen|eerst zal ik zwijgen|eerst zal ik zwijgen
eindelijk was het tijd voor het avondeten|eindelijk was het tijd voor het avondeten|eindelijk was het tijd voor het avondeten
ekaapmuinden graden zijn graden|ekaapmuinden graden zijn graden|ekaapmuinden graden zijn graden
elk jaar in het tweede weekend van augustus komen duizenden mensen in grote aantallen bijeen|elk jaar in het tweede weekend van augustus komen duizenden mensen in grote aantallen bijeen|elk jaar in het tweede weekend van augustus komen duizenden mensen in grote aantallen bijeen
elke keer als ik klaar ben met baden in de hot tub|elke keer als ik klaar ben met baden in de hot tub|elke keer als ik klaar ben met baden in de hot tub
elke keer als ik klaar ben met baden in een warm bad|elke keer als ik klaar ben met baden in een warm bad|elke keer als ik klaar ben met baden in een warm bad
elke ochtend leidde hij de schapen naar de wei|elke ochtend leidde hij de schapen naar de wei|elke ochtend leidde hij de schapen naar de wei
elke ochtend vond de familie een gouden ei in het kippenhok|elke ochtend vond de familie een gouden ei in het kippenhok|elke ochtend vond de familie een gouden ei in het kippenhok
en aangezien hij geen piano had die met zijn vingers speelde, zong hij een lied|en aangezien hij geen piano had die met zijn vingers speelde, zong hij een lied|en aangezien hij geen piano had die met zijn vingers speelde, zong hij een lied
en de hagedis luisterde, giet water in een pot en zette het op het vuur|en de hagedis luisterde, giet water in een pot en zette het op het vuur|en de hagedis luisterde, giet water in een pot en zette het op het vuur
en dus moesten we die belofte nakomen|en dus moesten we die belofte nakomen|en dus moesten we die belofte nakomen
en het is groen|en het is groen|en het is groen
en het verhaal was zo lief dat ik in slaap viel|en het verhaal was zo lief dat ik in slaap viel|en het verhaal was zo lief dat ik in slaap viel
en hij begon langzaam op weg naar huis|en hij begon langzaam op weg naar huis|en hij begon langzaam op weg naar huis
en hij kwam er nooit achter hoe hij haar verliet om de race te winnen|en hij kwam er nooit achter hoe hij haar verliet om de race te winnen|en hij kwam er nooit achter hoe hij haar verliet om de race te winnen
en hij stond op en ging weg|en hij stond op en ging weg|en hij stond op en ging weg
en hij verspreidde het gerucht|en hij verspreidde het gerucht|en hij verspreidde het gerucht
en ik kan mijn ziel luidruchtiger maken|en ik kan mijn ziel luidruchtiger maken|en ik kan mijn ziel luidruchtiger maken
en je wilt het altijd in de overtreffende trap zien|en je wilt het altijd in de overtreffende trap zien|en je wilt het altijd in de overtreffende trap zien
en mijn neus ruikt naar kwallen die op de loer liggen in de keuken van mijn moeder|en mijn neus ruikt naar kwallen die op de loer liggen in de keuken van mijn moeder|en mijn neus ruikt naar kwallen die op de loer liggen in de keuken van mijn moeder
en mijn ogen zijn beter dan uw staven|en mijn ogen zijn beter dan uw staven|en mijn ogen zijn beter dan uw staven
en vloog weer met de hoofdring een symbool van een getrouwde vrouw|en vloog weer met de hoofdring een symbool van een getrouwde vrouw|en vloog weer met de hoofdring een symbool van een getrouwde vrouw
en ze hoorden een geluid|en ze hoorden een geluid|en ze hoorden een geluid
en ze verlieten zijn moeder zonder een woord te zeggen|en ze verlieten zijn moeder zonder een woord te zeggen|en ze verlieten zijn moeder zonder een woord te zeggen
enkele krokodillen omsingelden de mannen toen ze dichterbij kwamen|enkele krokodillen omsingelden de mannen toen ze dichterbij kwamen|enkele krokodillen omsingelden de mannen toen ze dichterbij kwamen
er is code-sharing en er is overeenstemming om de dienstregeling met South African Airways te coördineren|er is code-sharing en er is overeenstemming om de dienstregeling met South African Airways te coördineren|er is code-sharing en er is overeenstemming om de dienstregeling met South African Airways te coördineren
er staat een drinkglas voor het raam|er staat een drinkglas voor het raam|er staat een drinkglas voor het raam
er waren ook mannen met sterke gele hoeden|er waren ook mannen met sterke gele hoeden|er waren ook mannen met sterke gele hoeden
er waren rotsen aan weerszijden van de rivier|er waren rotsen aan weerszijden van de rivier|er waren rotsen aan weerszijden van de rivier
er wordt een konijn uit zijn boshuis gehaald|er wordt een konijn uit zijn boshuis gehaald|er wordt een konijn uit zijn boshuis gehaald
er zat een brief in|er zat een brief in|er zat een brief in
