ID|transcription|normalized transcription
In Zuid-Afrika is het woord gekleurd racistisch en verwijst het naar mensen met een gemengde etnische achtergrond|In Zuid-Afrika is het woord gekleurd racistisch en verwijst het naar mensen met een gemengde etnische achtergrond|In Zuid-Afrika is het woord gekleurd racistisch en verwijst het naar mensen met een gemengde etnische achtergrond
in Zuid-Afrika is potjiekos een extern gekookte stoofpot|in Zuid-Afrika is potjiekos een extern gekookte stoofpot|in Zuid-Afrika is potjiekos een extern gekookte stoofpot
ja, zo zijn alle mindere dieren van vandaag rein|ja, zo zijn alle mindere dieren van vandaag rein|ja, zo zijn alle mindere dieren van vandaag rein
je hebt geen scherpe tanden zoals de mijne|je hebt geen scherpe tanden zoals de mijne|je hebt geen scherpe tanden zoals de mijne
je hebt waarschijnlijk al mijn rijpe sinaasappel|je hebt waarschijnlijk al mijn rijpe sinaasappel|je hebt waarschijnlijk al mijn rijpe sinaasappel
je hoeft geen lange benen te hebben om een ​​race te winnen, weet je|je hoeft geen lange benen te hebben om een ​​race te winnen, weet je|je hoeft geen lange benen te hebben om een ​​race te winnen, weet je
je kent het goede land dat dichtbij was|je kent het goede land dat dichtbij was|je kent het goede land dat dichtbij was
je kool ziet er geweldig uit|je kool ziet er geweldig uit|je kool ziet er geweldig uit
je kunt met mij zwemmen|je kunt met mij zwemmen|je kunt met mij zwemmen
Je leraar heeft ons deze kleuren geleerd, blauw, blauw, groen en zwart|Je leraar heeft ons deze kleuren geleerd, blauw, blauw, groen en zwart|Je leraar heeft ons deze kleuren geleerd, blauw, blauw, groen en zwart
je moest de pot op je hoofd dragen|je moest de pot op je hoofd dragen|je moest de pot op je hoofd dragen
je moest een touw om zijn nek binden en het achter je aan trekken|je moest een touw om zijn nek binden en het achter je aan trekken|je moest een touw om zijn nek binden en het achter je aan trekken
je wilt echt slim zijn, je voelt zoveel dat je met succes doorstaat|je wilt echt slim zijn, je voelt zoveel dat je met succes doorstaat|je wilt echt slim zijn, je voelt zoveel dat je met succes doorstaat
joja hield er helemaal niet van om een ​​luipaard te zijn|joja hield er helemaal niet van om een ​​luipaard te zijn|joja hield er helemaal niet van om een ​​luipaard te zijn
Jongensdoelman Jackson Mabokgwane blokkeerde de wedstrijd|Jongensdoelman Jackson Mabokgwane blokkeerde de wedstrijd|Jongensdoelman Jackson Mabokgwane blokkeerde de wedstrijd
justin jacobus kreeg een waarschuwing van de scheidsrechter|justin jacobus kreeg een waarschuwing van de scheidsrechter|justin jacobus kreeg een waarschuwing van de scheidsrechter
Kaapse Maleisische huizen verkopen koisteristen voor een half dozijn of dozijn op zondagochtend|Kaapse Maleisische huizen verkopen koisteristen voor een half dozijn of dozijn op zondagochtend|Kaapse Maleisische huizen verkopen koisteristen voor een half dozijn of dozijn op zondagochtend
kameraden maakten deel uit van de soep strikas-spellen|kameraden maakten deel uit van de soep strikas-spellen|kameraden maakten deel uit van de soep strikas-spellen
kauwt blauw|kauwt blauw|kauwt blauw
keek naar mijn hoed op een oude granaatappelboom|keek naar mijn hoed op een oude granaatappelboom|keek naar mijn hoed op een oude granaatappelboom
kempton park golfbaan staat bekend als een club waar ernie els golfen hebben leren spelen|kempton park golfbaan staat bekend als een club waar ernie els golfen hebben leren spelen|kempton park golfbaan staat bekend als een club waar ernie els golfen hebben leren spelen
Khalai wordt wakker en praat met de sinaasappelboom|Khalai wordt wakker en praat met de sinaasappelboom|Khalai wordt wakker en praat met de sinaasappelboom
Kimberly-temperaturen zijn 2 graden|Kimberly-temperaturen zijn 2 graden|Kimberly-temperaturen zijn 2 graden
knielde voor haar neer en vroeg haar om zijn vrouw te worden|knielde voor haar neer en vroeg haar om zijn vrouw te worden|knielde voor haar neer en vroeg haar om zijn vrouw te worden
kom bij ons studeren|kom bij ons studeren|kom bij ons studeren
kool ter grootte van het hoofd van een baby verscheen en de bonen kwamen door het hek omhoog|kool ter grootte van het hoofd van een baby verscheen en de bonen kwamen door het hek omhoog|kool ter grootte van het hoofd van een baby verscheen en de bonen kwamen door het hek omhoog
kwam hier beneden, zei mijn vriend de chauffeur|kwam hier beneden, zei mijn vriend de chauffeur|kwam hier beneden, zei mijn vriend de chauffeur
laat hem het volledige bedrag zien|laat hem het volledige bedrag zien|laat hem het volledige bedrag zien
laat hem je gouden ster houden, zei hij|laat hem je gouden ster houden, zei hij|laat hem je gouden ster houden, zei hij
laat me een bh tsotsi zoeken en dat stuk papier pakken|laat me een bh tsotsi zoeken en dat stuk papier pakken|laat me een bh tsotsi zoeken en dat stuk papier pakken
lachte de arend deze dieren konden alleen de dieren op de grond zien|lachte de arend deze dieren konden alleen de dieren op de grond zien|lachte de arend deze dieren konden alleen de dieren op de grond zien
laten we zwemmen, zei het geschenk|laten we zwemmen, zei het geschenk|laten we zwemmen, zei het geschenk
Later hoorde een rijke man over dit magische penseel|Later hoorde een rijke man over dit magische penseel|Later hoorde een rijke man over dit magische penseel
maak je geen zorgen vrienden hij is de kleinzoon van mijn grootvader|maak je geen zorgen vrienden hij is de kleinzoon van mijn grootvader|maak je geen zorgen vrienden hij is de kleinzoon van mijn grootvader
maak je geen zorgen, hij zei dat hij met een plan liep|maak je geen zorgen, hij zei dat hij met een plan liep|maak je geen zorgen, hij zei dat hij met een plan liep
maak je ontbijt af, zei oma|maak je ontbijt af, zei oma|maak je ontbijt af, zei oma
Macdougall klopte wantrouwend op zijn voorhoofd met zijn dikke wijsvinger|Macdougall klopte wantrouwend op zijn voorhoofd met zijn dikke wijsvinger|Macdougall klopte wantrouwend op zijn voorhoofd met zijn dikke wijsvinger
maggoze droomde ervan piloot te worden|maggoze droomde ervan piloot te worden|maggoze droomde ervan piloot te worden
Manchester United versloeg Manchester City door Manchester United|Manchester United versloeg Manchester City door Manchester United|Manchester United versloeg Manchester City door Manchester United
mannen die het verdragen noemen het een levende dood|mannen die het verdragen noemen het een levende dood|mannen die het verdragen noemen het een levende dood
Maritzburg United versloeg Swansea City door een puntloos gelijkspel na strafschoppen|Maritzburg United versloeg Swansea City door een puntloos gelijkspel na strafschoppen|Maritzburg United versloeg Swansea City door een puntloos gelijkspel na strafschoppen
Markeer welke pet ik vandaag draag|Markeer welke pet ik vandaag draag|Markeer welke pet ik vandaag draag
Meneer Konijn keek op en zag de man in het blauwe uniform|Meneer Konijn keek op en zag de man in het blauwe uniform|Meneer Konijn keek op en zag de man in het blauwe uniform
Meneer Konijn kijkt naar de nieuwe folder|Meneer Konijn kijkt naar de nieuwe folder|Meneer Konijn kijkt naar de nieuwe folder
Meneer Konijn zag mensen in de rij staan ​​om in de taxi te stappen|Meneer Konijn zag mensen in de rij staan ​​om in de taxi te stappen|Meneer Konijn zag mensen in de rij staan ​​om in de taxi te stappen
mengt nu het hele mengsel van andere variëteiten|mengt nu het hele mengsel van andere variëteiten|mengt nu het hele mengsel van andere variëteiten
met het geluid van geldschieters is de echte beloning die je krijgt voor een gestolen zoete geur|met het geluid van geldschieters is de echte beloning die je krijgt voor een gestolen zoete geur|met het geluid van geldschieters is de echte beloning die je krijgt voor een gestolen zoete geur
meteorologische diensten voorspellen de kans op een milde oostenwind|meteorologische diensten voorspellen de kans op een milde oostenwind|meteorologische diensten voorspellen de kans op een milde oostenwind
Meteorologische diensten voorspellen regenval in de noordwestelijke provincie|Meteorologische diensten voorspellen regenval in de noordwestelijke provincie|Meteorologische diensten voorspellen regenval in de noordwestelijke provincie
meteorologische diensten voorspellen regenval in de westelijke kaap|meteorologische diensten voorspellen regenval in de westelijke kaap|meteorologische diensten voorspellen regenval in de westelijke kaap
meter nemen west|meter nemen west|meter nemen west
meters draaien naar rechts en houden dan links aan|meters draaien naar rechts en houden dan links aan|meters draaien naar rechts en houden dan links aan
middenvelder koper gopane trapte schoppen in de hoek|middenvelder koper gopane trapte schoppen in de hoek|middenvelder koper gopane trapte schoppen in de hoek
middenvelder Tshepang Machedi trapte de bal in de doelpaal|middenvelder Tshepang Machedi trapte de bal in de doelpaal|middenvelder Tshepang Machedi trapte de bal in de doelpaal
mijn naam is pauline|mijn naam is pauline|mijn naam is pauline
mijn pet werd ondersteund door een tak van een oude pijnboom|mijn pet werd ondersteund door een tak van een oude pijnboom|mijn pet werd ondersteund door een tak van een oude pijnboom
mijn vriend Glory houdt van voetbal|mijn vriend Glory houdt van voetbal|mijn vriend Glory houdt van voetbal
morgen ga ik achter die beer aan, zei hij|morgen ga ik achter die beer aan, zei hij|morgen ga ik achter die beer aan, zei hij
morgen is het zondag en eten we alleen kool als avondeten|morgen is het zondag en eten we alleen kool als avondeten|morgen is het zondag en eten we alleen kool als avondeten
na een tijdje zie je een uil|na een tijdje zie je een uil|na een tijdje zie je een uil
naar welk artikel u verwijst|naar welk artikel u verwijst|naar welk artikel u verwijst
naast zijn zijde glinsterden de witte slagtanden van een wolfshond|naast zijn zijde glinsterden de witte slagtanden van een wolfshond|naast zijn zijde glinsterden de witte slagtanden van een wolfshond
nee het doet het gewoon niet|nee het doet het gewoon niet|nee het doet het gewoon niet
neem voor deze kilometers de afslag naar links|neem voor deze kilometers de afslag naar links|neem voor deze kilometers de afslag naar links
neem voor deze kilometers r naar harrismith|neem voor deze kilometers r naar harrismith|neem voor deze kilometers r naar harrismith
neem voor deze kilometers r noordwaarts|neem voor deze kilometers r noordwaarts|neem voor deze kilometers r noordwaarts
negenennegentig|negenennegentig|negenennegentig
niet door die trucs, zei ululu|niet door die trucs, zei ululu|niet door die trucs, zei ululu
O arm varken|O arm varken|O arm varken
oh daar regent het weer|oh daar regent het weer|oh daar regent het weer
oh het was zo comfortabel het was zo warm dat het me niet stoorde|oh het was zo comfortabel het was zo warm dat het me niet stoorde|oh het was zo comfortabel het was zo warm dat het me niet stoorde
oh jij leugenaar denk je dat ik je weer kan geloven|oh jij leugenaar denk je dat ik je weer kan geloven|oh jij leugenaar denk je dat ik je weer kan geloven
Oh mijn baby, zei mijn moeder met een geruststellende stem|Oh mijn baby, zei mijn moeder met een geruststellende stem|Oh mijn baby, zei mijn moeder met een geruststellende stem
oh mijn heer zei zijn vader|oh mijn heer zei zijn vader|oh mijn heer zei zijn vader
oh nee zei de stad|oh nee zei de stad|oh nee zei de stad
oh zei hij opgewonden|oh zei hij opgewonden|oh zei hij opgewonden
ok zei, weet je, laten we een wedstrijd houden|ok zei, weet je, laten we een wedstrijd houden|ok zei, weet je, laten we een wedstrijd houden
onder graden graden in de Earlington zijn er ook harde wind|onder graden graden in de Earlington zijn er ook harde wind|onder graden graden in de Earlington zijn er ook harde wind
onderweg moesten ze over een kort kamphekje springen|onderweg moesten ze over een kort kamphekje springen|onderweg moesten ze over een kort kamphekje springen
onze jurk is niet langer mooi|onze jurk is niet langer mooi|onze jurk is niet langer mooi
oolong-atol was honderdveertig mijl in omtrek|oolong-atol was honderdveertig mijl in omtrek|oolong-atol was honderdveertig mijl in omtrek
op de markt sprak hij met iedereen|op de markt sprak hij met iedereen|op de markt sprak hij met iedereen
Op een dag kwamen alle dieren bij elkaar|Op een dag kwamen alle dieren bij elkaar|Op een dag kwamen alle dieren bij elkaar
op een dag kwamen de soldaten|op een dag kwamen de soldaten|op een dag kwamen de soldaten
op een dag reed hij haar van school naar huis|op een dag reed hij haar van school naar huis|op een dag reed hij haar van school naar huis
op een dag tijdens de hongersnood nodigde het konijn zijn vriend uit om te komen spelen|op een dag tijdens de hongersnood nodigde het konijn zijn vriend uit om te komen spelen|op een dag tijdens de hongersnood nodigde het konijn zijn vriend uit om te komen spelen
op een ochtend verscheen er een rattenmoeras op de kop in riet op de oever van de rivier|op een ochtend verscheen er een rattenmoeras op de kop in riet op de oever van de rivier|op een ochtend verscheen er een rattenmoeras op de kop in riet op de oever van de rivier
op een regenachtige dag werd de speer van een tijger nat|op een regenachtige dag werd de speer van een tijger nat|op een regenachtige dag werd de speer van een tijger nat
op en neer springen|op en neer springen|op en neer springen
op het strand op maandag de dag van maart|op het strand op maandag de dag van maart|op het strand op maandag de dag van maart
op hogere graden valt er zware hagel|op hogere graden valt er zware hagel|op hogere graden valt er zware hagel
op vrijdag vertelt de leraar in jou dat we onze verhalen aan de klas moeten vertellen|op vrijdag vertelt de leraar in jou dat we onze verhalen aan de klas moeten vertellen|op vrijdag vertelt de leraar in jou dat we onze verhalen aan de klas moeten vertellen
oranjekleurige sinaasappels|oranjekleurige sinaasappels|oranjekleurige sinaasappels
over te portia modise|over te portia modise|over te portia modise
pas op dat u het niet breekt|pas op dat u het niet breekt|pas op dat u het niet breekt
per kilometer breng n naar de kolen|per kilometer breng n naar de kolen|per kilometer breng n naar de kolen
Plots verscheen er een oude vrouw|Plots verscheen er een oude vrouw|Plots verscheen er een oude vrouw
plotseling zag hij een pilre geschilderd als een schilderij in de lucht|plotseling zag hij een pilre geschilderd als een schilderij in de lucht|plotseling zag hij een pilre geschilderd als een schilderij in de lucht
Port Shepstone Temperaturen beneden graden, er zijn onweersbuien in sommige gebieden|Port Shepstone Temperaturen beneden graden, er zijn onweersbuien in sommige gebieden|Port Shepstone Temperaturen beneden graden, er zijn onweersbuien in sommige gebieden
praat er met uw kinderen over|praat er met uw kinderen over|praat er met uw kinderen over
santie houdt van jurken|santie houdt van jurken|santie houdt van jurken
schoonheid en cadeau en liefde gaan uit en spelen|schoonheid en cadeau en liefde gaan uit en spelen|schoonheid en cadeau en liefde gaan uit en spelen
slechts een maand voor de start van de FIFA World Cup|slechts een maand voor de start van de FIFA World Cup|slechts een maand voor de start van de FIFA World Cup
slim en problematisch|slim en problematisch|slim en problematisch
soms werden ze gearresteerd en soms werden ze geslagen|soms werden ze gearresteerd en soms werden ze geslagen|soms werden ze gearresteerd en soms werden ze geslagen
sorry maar ik kan je niet blijven bevrijden|sorry maar ik kan je niet blijven bevrijden|sorry maar ik kan je niet blijven bevrijden
speel goed, goede koningen|speel goed, goede koningen|speel goed, goede koningen
sprong de jongen|sprong de jongen|sprong de jongen
Standerton-temperaturen zijn graden Celsius|Standerton-temperaturen zijn graden Celsius|Standerton-temperaturen zijn graden Celsius
supersport united league versloeg jomo cosmos met vier punten|supersport united league versloeg jomo cosmos met vier punten|supersport united league versloeg jomo cosmos met vier punten
tegelijkertijd besloot de domino bovenop de kleerkast te springen|tegelijkertijd besloot de domino bovenop de kleerkast te springen|tegelijkertijd besloot de domino bovenop de kleerkast te springen
teken een foto van de scène en teken een tekstballon voor de oude dame|teken een foto van de scène en teken een tekstballon voor de oude dame|teken een foto van de scène en teken een tekstballon voor de oude dame
temperaturen iniesiesfontein graden zijn ook aanwezig in vochtigheid|temperaturen iniesiesfontein graden zijn ook aanwezig in vochtigheid|temperaturen iniesiesfontein graden zijn ook aanwezig in vochtigheid
temperaturen zonder regen in Port Elizabeth|temperaturen zonder regen in Port Elizabeth|temperaturen zonder regen in Port Elizabeth
ten slotte stopte de taxichauffeur bij de rang|ten slotte stopte de taxichauffeur bij de rang|ten slotte stopte de taxichauffeur bij de rang
tenslotte slikte hij alle schors en schors van de zon naar binnen|tenslotte slikte hij alle schors en schors van de zon naar binnen|tenslotte slikte hij alle schors en schors van de zon naar binnen
terwijl ze in de klas zitten komt de aap naar buiten|terwijl ze in de klas zitten komt de aap naar buiten|terwijl ze in de klas zitten komt de aap naar buiten
Thabo Thaba Mataba van de jongens blokkeerde de wedstrijd|Thabo Thaba Mataba van de jongens blokkeerde de wedstrijd|Thabo Thaba Mataba van de jongens blokkeerde de wedstrijd
Thabo Thababa, de doelman van de jongens, scoorde een hattrick in de wedstrijd|Thabo Thababa, de doelman van de jongens, scoorde een hattrick in de wedstrijd|Thabo Thababa, de doelman van de jongens, scoorde een hattrick in de wedstrijd
Thoko legde huilend haar weg naar huis uit van school|Thoko legde huilend haar weg naar huis uit van school|Thoko legde huilend haar weg naar huis uit van school
tijdens de eerste helft is de score dat niet|tijdens de eerste helft is de score dat niet|tijdens de eerste helft is de score dat niet
tijdens de eerste helft punten|tijdens de eerste helft punten|tijdens de eerste helft punten
tijdens het feest at en dronk het konijn tot hij danste|tijdens het feest at en dronk het konijn tot hij danste|tijdens het feest at en dronk het konijn tot hij danste
Tijdens zijn ambtsperiode groeide de economie dit jaar gemiddeld|Tijdens zijn ambtsperiode groeide de economie dit jaar gemiddeld|Tijdens zijn ambtsperiode groeide de economie dit jaar gemiddeld
toen de leraar zich omdraaide, was er niemand in de klas|toen de leraar zich omdraaide, was er niemand in de klas|toen de leraar zich omdraaide, was er niemand in de klas
toen de organisatie werd gevormd|toen de organisatie werd gevormd|toen de organisatie werd gevormd
toen hij wakker werd was hij er niet, maar hij had een zucht in zijn hart achtergelaten|toen hij wakker werd was hij er niet, maar hij had een zucht in zijn hart achtergelaten|toen hij wakker werd was hij er niet, maar hij had een zucht in zijn hart achtergelaten
toen ik het deksel van de pot open sloeg|toen ik het deksel van de pot open sloeg|toen ik het deksel van de pot open sloeg
toen trok hij de reche r uit de vingers van het konijn|toen trok hij de reche r uit de vingers van het konijn|toen trok hij de reche r uit de vingers van het konijn
Toen ze aankwamen, dacht ik dat de jakhals was teruggekeerd naar de bush|Toen ze aankwamen, dacht ik dat de jakhals was teruggekeerd naar de bush|Toen ze aankwamen, dacht ik dat de jakhals was teruggekeerd naar de bush
Toen ze bij de rivier kwamen, wisselden ze van houding en het konijn beviel op de rug van een schildpad|Toen ze bij de rivier kwamen, wisselden ze van houding en het konijn beviel op de rug van een schildpad|Toen ze bij de rivier kwamen, wisselden ze van houding en het konijn beviel op de rug van een schildpad
tota verstopte zich achter het bord|tota verstopte zich achter het bord|tota verstopte zich achter het bord
Tussen hem en de zee was de stad omgeven door suikerriet|Tussen hem en de zee was de stad omgeven door suikerriet|Tussen hem en de zee was de stad omgeven door suikerriet
twee dagen geleden ontdekte jeanne waar de mannen van haar vader zaten|twee dagen geleden ontdekte jeanne waar de mannen van haar vader zaten|twee dagen geleden ontdekte jeanne waar de mannen van haar vader zaten
ulamboo en zhoola waren in de war|ulamboo en zhoola waren in de war|ulamboo en zhoola waren in de war
Uncanda had hem in de race achtergelaten|Uncanda had hem in de race achtergelaten|Uncanda had hem in de race achtergelaten
Usibusiso Masina duwde de bal naar voren|Usibusiso Masina duwde de bal naar voren|Usibusiso Masina duwde de bal naar voren
utefo masiteng gaf de bal door aan de film karuru|utefo masiteng gaf de bal door aan de film karuru|utefo masiteng gaf de bal door aan de film karuru
uw brief is op tijd aangekomen|uw brief is op tijd aangekomen|uw brief is op tijd aangekomen
uw man heeft ons gestuurd om uw hoofdring te brengen|uw man heeft ons gestuurd om uw hoofdring te brengen|uw man heeft ons gestuurd om uw hoofdring te brengen
uw toorn overweldigt mij|uw toorn overweldigt mij|uw toorn overweldigt mij
valse instructies leiden u uit het vliegtuig op de weg|valse instructies leiden u uit het vliegtuig op de weg|valse instructies leiden u uit het vliegtuig op de weg
vanavond betaal ik je een goed salaris|vanavond betaal ik je een goed salaris|vanavond betaal ik je een goed salaris
verpakt of besprenkeld met gedroogde kokos|verpakt of besprenkeld met gedroogde kokos|verpakt of besprenkeld met gedroogde kokos
vertelde mijn moeder hem|vertelde mijn moeder hem|vertelde mijn moeder hem
verzonden naar de scheidsrechter ontving een waarschuwing van de scheidsrechter|verzonden naar de scheidsrechter ontving een waarschuwing van de scheidsrechter|verzonden naar de scheidsrechter ontving een waarschuwing van de scheidsrechter
virgil vries kreeg een gele kaart van de scheidsrechter|virgil vries kreeg een gele kaart van de scheidsrechter|virgil vries kreeg een gele kaart van de scheidsrechter
vleugelspeler unoah sadaoui trapte de bal in de doelpaal|vleugelspeler unoah sadaoui trapte de bal in de doelpaal|vleugelspeler unoah sadaoui trapte de bal in de doelpaal
vlinders zitten op de ruggen en koppen van krokodillen|vlinders zitten op de ruggen en koppen van krokodillen|vlinders zitten op de ruggen en koppen van krokodillen
volg mijn kind|volg mijn kind|volg mijn kind
volg r een afstand van mijlen|volg r een afstand van mijlen|volg r een afstand van mijlen
voor nu ga ik magie inademen|voor nu ga ik magie inademen|voor nu ga ik magie inademen
Voorafgaand aan de afwijzing van de sportsamenwerking had Zuid-Afrika de controle over de samenwerkingsvoorwaarden tot het jaar van|Voorafgaand aan de afwijzing van de sportsamenwerking had Zuid-Afrika de controle over de samenwerkingsvoorwaarden tot het jaar van|Voorafgaand aan de afwijzing van de sportsamenwerking had Zuid-Afrika de controle over de samenwerkingsvoorwaarden tot het jaar van
voorheen was het in dezelfde groep opgenomen, hoewel het niet gerelateerd was aan de soort|voorheen was het in dezelfde groep opgenomen, hoewel het niet gerelateerd was aan de soort|voorheen was het in dezelfde groep opgenomen, hoewel het niet gerelateerd was aan de soort
Vusi schreeuwde tegen zijn grootmoeder|Vusi schreeuwde tegen zijn grootmoeder|Vusi schreeuwde tegen zijn grootmoeder
waar ga je naar toe|waar ga je naar toe|waar ga je naar toe
waarom is dit zoutwit|waarom is dit zoutwit|waarom is dit zoutwit
waarom ze zo effectief werken|waarom ze zo effectief werken|waarom ze zo effectief werken
walvissen en haaien kunnen alleen zeedieren zien|walvissen en haaien kunnen alleen zeedieren zien|walvissen en haaien kunnen alleen zeedieren zien
wanneer gaat haar vader op vakantie|wanneer gaat haar vader op vakantie|wanneer gaat haar vader op vakantie
wanneer het spel wordt gespeeld|wanneer het spel wordt gespeeld|wanneer het spel wordt gespeeld
wanneer win je het toernooi|wanneer win je het toernooi|wanneer win je het toernooi
was hij de architect van het huis|was hij de architect van het huis|was hij de architect van het huis
wat een schuimleger om achter de ziektekiemen te jagen|wat een schuimleger om achter de ziektekiemen te jagen|wat een schuimleger om achter de ziektekiemen te jagen
wat ga je morgen doen|wat ga je morgen doen|wat ga je morgen doen
wat het woord betekent|wat het woord betekent|wat het woord betekent
wat is de context van het hoger onderwijs|wat is de context van het hoger onderwijs|wat is de context van het hoger onderwijs
wat is er met australië gebeurd|wat is er met australië gebeurd|wat is er met australië gebeurd
waterbloemen worden gebruikt om stoofpot van te maken|waterbloemen worden gebruikt om stoofpot van te maken|waterbloemen worden gebruikt om stoofpot van te maken
we gingen allemaal naar een eerlijke beurs|we gingen allemaal naar een eerlijke beurs|we gingen allemaal naar een eerlijke beurs
we kunnen de rijen krijgen als je klaar bent|we kunnen de rijen krijgen als je klaar bent|we kunnen de rijen krijgen als je klaar bent
we renden het huis uit|we renden het huis uit|we renden het huis uit
we zien geen jakhals, zei een ander|we zien geen jakhals, zei een ander|we zien geen jakhals, zei een ander
we zien je verf en er zit een gat in|we zien je verf en er zit een gat in|we zien je verf en er zit een gat in
we zullen moeten doen alsof we erger praten dan hij nadrukkelijk zei|we zullen moeten doen alsof we erger praten dan hij nadrukkelijk zei|we zullen moeten doen alsof we erger praten dan hij nadrukkelijk zei
we zullen spelen|we zullen spelen|we zullen spelen
Weerdiensten hebben een waarschuwing afgegeven voor hevige regenval|Weerdiensten hebben een waarschuwing afgegeven voor hevige regenval|Weerdiensten hebben een waarschuwing afgegeven voor hevige regenval
